<?xml version="1.0" encoding="UTF-8"?>
<NR_beadando xmlns:xsi="http://www.w3.org/2001/XMLSchema-instance" xsi:noNamespaceSchemaLocation="XMLSchemaJmdrgg.xsd">
  <cukraszda c_id="c1">
    <nev>Daubner Cukrászda</nev>
    <hely>
      <varos>Budapest</varos>
      <utca>Szépvölgyi </utca>
      <hazszam>50</hazszam>
    </hely>
    <ertekeles>4.3</ertekeles>
    <tulajdonos>Pista Laci</tulajdonos>
    <weboldal>daubnercukraszda.hu</weboldal>
  </cukraszda>
  <cukraszda c_id="c2">
    <nev>Frey Cukrászda</nev>
    <hely>
      <varos>Pécs</varos>
      <utca>Hungária</utca>
      <hazszam>53/1</hazszam>
    </hely>
    <ertekeles>4.7</ertekeles>
    <tulajdonos>Rotyis Bálint</tulajdonos>
    <weboldal>freycukraszda.hu</weboldal>
  </cukraszda>
  <cukraszda c_id="c3">
    <nev>Szűőke cukrászda</nev>
    <hely>
      <varos>Debrecen</varos>
      <utca>Úrrétje</utca>
      <hazszam>14</hazszam>
    </hely>
    <ertekeles>4.5</ertekeles>
    <tulajdonos>Szőke Balázs</tulajdonos>
    <weboldal>szokecukraszda.hu</weboldal>
  </cukraszda>
  <cukrasz cu_c="c1" cu_id="cu1">
    <nev>
      <vezeteknev>Tompa</vezeteknev>
      <keresztnev>Tamás</keresztnev>
    </nev>
    <eletkor>57</eletkor>
    <nem>férfi</nem>
  </cukrasz>
  <cukrasz cu_c="c1" cu_id="cu2">
    <nev>
      <vezeteknev>Patkós</vezeteknev>
      <keresztnev>Petra</keresztnev>
    </nev>
    <eletkor>21</eletkor>
    <nem>nő</nem>
  </cukrasz>
  <cukrasz cu_c="c1" cu_id="cu3">
    <nev>
      <vezeteknev>Nagy</vezeteknev>
      <keresztnev>Bence</keresztnev>
    </nev>
    <eletkor>18</eletkor>
    <nem>férfi</nem>
  </cukrasz>
  <cukrasz cu_c="c2" cu_id="cu4">
    <nev>
      <vezeteknev>Szabó</vezeteknev>
      <keresztnev>Bence</keresztnev>
    </nev>
    <eletkor>21</eletkor>
    <nem>férfi</nem>
  </cukrasz>
  <cukrasz cu_c="c2" cu_id="cu5">
    <nev>
      <vezeteknev>Mathers</vezeteknev>
      <keresztnev>Marshall</keresztnev>
    </nev>
    <eletkor>50</eletkor>
    <nem>férfi</nem>
  </cukrasz>
  <cukrasz cu_c="c2" cu_id="cu6">
    <nev>
      <vezeteknev>Jepsen</vezeteknev>
      <keresztnev>Carly</keresztnev>
    </nev>
    <eletkor>36</eletkor>
    <nem>nő</nem>
  </cukrasz>
  <cukrasz cu_c="c3" cu_id="cu7">
    <nev>
      <vezeteknev>Snake</vezeteknev>
      <keresztnev>David</keresztnev>
    </nev>
    <eletkor>24</eletkor>
    <nem>férfi</nem>
  </cukrasz>
  <cukrasz cu_c="c3" cu_id="cu8">
    <nev>
      <vezeteknev>McMillen</vezeteknev>
      <keresztnev>Edmund</keresztnev>
    </nev>
    <eletkor>42</eletkor>
    <nem>férfi</nem>
  </cukrasz>
  <cukrasz cu_c="c3" cu_id="cu9">
    <nev>
      <vezeteknev>Fors</vezeteknev>
      <keresztnev>Sebastian</keresztnev>
    </nev>
    <eletkor>31</eletkor>
    <nem>férfi</nem>
  </cukrasz>
  <sutemeny_lista sl_c="c1" sl_id="sl1">
    <legnepszerubb>Mignon</legnepszerubb>
    <legnepszerutlenebb>Almás pite</legnepszerutlenebb>
    <legutobb_frissitve>2022-04-26</legutobb_frissitve>
  </sutemeny_lista>
  <sutemeny_lista sl_c="c2" sl_id="sl2">
    <legnepszerubb>Képviselőfánk</legnepszerubb>
    <legnepszerutlenebb>Piskótatekercs</legnepszerutlenebb>
    <legutobb_frissitve>2022-06-22</legutobb_frissitve>
  </sutemeny_lista>
  <sutemeny_lista sl_c="c3" sl_id="sl3">
    <legnepszerubb>Joghurtos epertorta szelet</legnepszerubb>
    <legnepszerutlenebb>Somlói galuska</legnepszerutlenebb>
    <legutobb_frissitve>2022-03-20</legutobb_frissitve>
  </sutemeny_lista>
  <sutemeny s_id="s2" s_sl="sl1">
    <nev>Mandarinos túrótorta szelet</nev>
    <ar>990</ar>
    <kaloria>360</kaloria>
    <tulajdonsag>csokoládés piskóta</tulajdonsag>
    <tulajdonsag>gyümölcsös</tulajdonsag>
    <tulajdonsag>klasszikus tortaszelet</tulajdonsag>
    <tulajdonsag>tejszínes</tulajdonsag>
    <tulajdonsag>torta szelet</tulajdonsag>
    <tulajdonsag>túrós</tulajdonsag>
  </sutemeny>
  <sutemeny s_id="s3" s_sl="sl1">
    <nev>Cukormentes málnatorta szelet</nev>
    <ar>860</ar>
    <kaloria>200</kaloria>
    <tulajdonsag>Cukormentes </tulajdonsag>
    <tulajdonsag>málnás</tulajdonsag>
    <tulajdonsag>Mandulás</tulajdonsag>
    <tulajdonsag>piskóta</tulajdonsag>
    <tulajdonsag>torta szelet</tulajdonsag>
  </sutemeny>
  <sutemeny s_id="s10" s_sl="sl3">
    <nev>Somlói galuska</nev>
    <ar>1100</ar>
    <kaloria>450</kaloria>
    <tulajdonsag>csokoládé öntet</tulajdonsag>
    <tulajdonsag>Csokoládés</tulajdonsag>
    <tulajdonsag>mazsolás</tulajdonsag>
    <tulajdonsag>piskóta</tulajdonsag>
    <tulajdonsag>tejszínhabos</tulajdonsag>
  </sutemeny>
  <vasarlo v_id="v1">
    <nev>
      <vezeteknev>Nagy</vezeteknev>
      <keresztnev>Pista</keresztnev>
    </nev>
    <torzsvasarlo>igen</torzsvasarlo>
    <eletkor>21</eletkor>
    <nem>férfi</nem>
  </vasarlo>
  <vasarlo v_id="v2">
    <nev>
      <vezeteknev>Sándor</vezeteknev>
      <keresztnev>Béla</keresztnev>
    </nev>
    <torzsvasarlo>nem</torzsvasarlo>
    <eletkor>26</eletkor>
    <nem>nő</nem>
  </vasarlo>
  <vasarlo v_id="v3">
    <nev>
      <vezeteknev>Ferenc</vezeteknev>
      <keresztnev>Viktor</keresztnev>
    </nev>
    <torzsvasarlo>nem</torzsvasarlo>
    <eletkor>56</eletkor>
    <nem>férfi</nem>
  </vasarlo>
  <tranzakcio s_t="s1" v_t="v1">
    <datum>2022-03-20</datum>
  </tranzakcio>
  <tranzakcio s_t="s2" v_t="v1">
    <datum>2022-03-20</datum>
  </tranzakcio>
  <tranzakcio s_t="s4" v_t="v1">
    <datum>2022-04-01</datum>
  </tranzakcio>
  <tranzakcio s_t="s5" v_t="v1">
    <datum>2022-04-01</datum>
  </tranzakcio>
  <tranzakcio s_t="s9" v_t="v1">
    <datum>2022-04-01</datum>
  </tranzakcio>
  <tranzakcio s_t="s2" v_t="v2">
    <datum>2022-04-12</datum>
  </tranzakcio>
  <tranzakcio s_t="s1" v_t="v2">
    <datum>2022-04-12</datum>
  </tranzakcio>
  <tranzakcio s_t="s4" v_t="v2">
    <datum>2022-05-02</datum>
  </tranzakcio>
  <tranzakcio s_t="s1" v_t="v2">
    <datum>2022-09-11</datum>
  </tranzakcio>
  <tranzakcio s_t="s3" v_t="v2">
    <datum>2022-09-11</datum>
  </tranzakcio>
  <tranzakcio s_t="s5" v_t="v2">
    <datum>2022-03-05</datum>
  </tranzakcio>
  <tranzakcio s_t="s7" v_t="v3">
    <datum>2022-03-05</datum>
  </tranzakcio>
  <tranzakcio s_t="s8" v_t="v3">
    <datum>2022-05-25</datum>
  </tranzakcio>
  <tranzakcio s_t="s9" v_t="v3">
    <datum>2022-10-03</datum>
  </tranzakcio>
  <tranzakcio s_t="s10" v_t="v3">
    <datum>2022-10-03</datum>
  </tranzakcio>
  <tranzakcio s_t="s2" v_t="v3">
    <datum>2022-10-03</datum>
  </tranzakcio>
  <tranzakcio s_t="s4" v_t="v3">
    <datum>2022-10-09</datum>
  </tranzakcio>
  <tranzakcio s_t="s3" v_t="v3">
    <datum>2022-11-02</datum>
  </tranzakcio>
</NR_beadando>